"type (S)","date (S)","info (M)","name (S)"
"interactive viz","10/10/2018, 12:00:00 AM","{  ""author"" : { ""SS"" : [      ""Adam Pearce"",      ""Claire Cain Miller"",      ""Emily Badger"",      ""Kevin Quealy""    ]  },  ""link"" : { ""S"" : ""https://www.nytimes.com/interactive/2018/03/19/upshot/race-class-white-and-black-men.html"" },  ""picture"" : { ""S"" : ""https://raw.githubusercontent.com/ryanabest/data-structures/master/week5/examples/O_tw_rUu.jpeg"" },  ""pubDate"" : { ""S"" : ""Mon Mar 19 2018"" },  ""publication"" : { ""S"" : ""New York Times (The Upshot)"" },  ""social"" : { ""S"" : ""https://twitter.com/UpshotNYT/status/975774912764882946"" },  ""tags"" : { ""SS"" : [      ""animation"",      ""politics"",      ""race"",      ""sankey"",      ""storytelling""    ]  },  ""thoughts"" : { ""L"" : [      { ""S"" : ""Use of multiple animated visualizations isn't animation for animation's sake - it serves as a useful and intuititve explanation of concepts and an effective tool that facilitates a cohesive story."" },      { ""S"" : ""I would have liked to see options to either speed up the animated visualization or see what the sankeychart would look like in static form, allowing users to interpret these findings from multiple angles and at different levels of detail."" },      { ""S"" : ""The story itself is a sobering portrayal of societal issues of economic immobility for black men in the U.S, bringing new in-depth analysis and extensive data to an ever-important and oft-overlooked conversation in our national landscape."" }    ]  }}","Extensive Data Shows Punishing Reach of Racism for Black Boys"
"interactive viz","10/11/2018, 12:00:00 AM","{  ""author"" : { ""S"" : ""Moritz Stefaner"" },  ""awards"" : { ""S"" : ""Information is Beautiful Awards 2017 - Gold"" },  ""documentation"" : { ""S"" : ""https://truth-and-beauty.net/projects/the-rhythm-of-food"" },  ""link"" : { ""S"" : ""http://rhythm-of-food.net/"" },  ""picture"" : { ""SS"" : [      ""https://truth-and-beauty.net/content/1-projects/30-the-rhythm-of-food/01-apricot-highlight.png"",      ""https://truth-and-beauty.net/content/1-projects/30-the-rhythm-of-food/02-charts-02.png"",      ""https://truth-and-beauty.net/content/1-projects/30-the-rhythm-of-food/02-elderberry.png""    ]  },  ""tags"" : { ""SS"" : [      ""cyclical"",      ""explorative"",      ""food"",      ""gradient"",      ""storytelling"",      ""timeline"",      ""visualization""    ]  },  ""thoughts"" : { ""L"" : [      { ""S"" : ""Moritz really nails the narrative structure here in how he explains his use of a novel visualization technique that could be hard to understand, walking us through how to interpret the rest of the piece an engaging and intuitive way."" },      { ""S"" : ""Also does a great job of highlighting the interesting graphics at once, which provides real analytic insight early on in the project, and in calling out interesting points within a graphic, adding context that aids in our understanding."" },      { ""S"" : ""'It's October, what is being asked for now?' is a nice touch that grounds the project in the current experience of its user and anticipating the user's needs or interests from this project."" }    ]  },  ""video"" : { ""S"" : ""https://vimeo.com/193889103"" }}","The Rhythm Of Food"
"interactive viz","10/19/2018, 12:00:00 AM","{  ""author"" : { ""S"" : ""Chris Wong"" },  ""author_page"" : { ""S"" : ""https://chriswhong.com/"" },  ""awards"" : { ""S"" : ""Information is Beautiful Awards 2014 - Best Motion Infographic - Gold"" },  ""link"" : { ""S"" : ""https://chriswhong.github.io/nyctaxi/"" },  ""picture"" : { ""S"" : ""https://iibawards-prod.s3.amazonaws.com/projects/images/000/000/594/large.jpg?1467151682"" },  ""tags"" : { ""SS"" : [      ""LeafLet"",      ""New York"",      ""animation"",      ""mapping""    ]  },  ""thoughts"" : { ""L"" : [      { ""S"" : ""I love this project - it's such a fun exploration of one random taxi driver's shift in New York. We watch our driver take us from place to place and see how many trips and fares they've accumulated throughout the day."" },      { ""S"" : ""I particularly enjoy how Chris keeps the taxi dot static and moves the map behind this point, while behind the paths of each passenger's trip and continually filling up the map based on where this taxi traveled while the meter was running. This approach really makes the map look and feel alive and gives each taxi a unique footprint on the map."" },      { ""S"" : ""I would have really liked to see visualizations of this data at the next level higher, combining data from multiple taxis in the dataset - was the taxi trip I just watched indicative of the norm across all taxis? How many taxis earned less over the same time span? More? Which taxis covered the most ground? These questions are somewhat out of the scope of this exploratory project, but I think exploring them would provide useful context and make this project much more cohesive and exhaustive."" },      { ""S"" : ""I ended up drawing a lot of inspriation from this animated map approach, using this project as a jumping off point for my Migration of Art project from my Major Studio I course last year. Chris's technical and design appendices helped me out a ton!"" },      { ""S"" : ""Without speeding up the animation speed, it also takes a bit of a long time to get through a whole taxi shift, which I think is a bit of a missed opportunity. The path this taxi has driven at the end of its shift, filled with individual fares and passengers, forms an interesting and unique shape - this aspect of the visualization was sacrificed a bit for the sake of the animation."" }    ]  }}","NYC Taxis: A Day in the Life"
"interactive viz","10/20/2018, 12:00:00 AM","{  ""author"" : { ""S"" : ""Dave Merrill and Lauren Leatherby"" },  ""link"" : { ""S"" : ""https://www.bloomberg.com/graphics/2018-us-land-use/"" },  ""pubDate"" : { ""S"" : ""Tue Jul 31 2018"" },  ""publication"" : { ""S"" : ""Bloomberg"" },  ""tags"" : { ""SS"" : [      ""mapping"",      ""scrollytelling""    ]  },  ""thoughts"" : { ""L"" : [      { ""S"" : ""I like the novel approach to data visualization here - this project uses the outline of the continental United States both as a map (showing where land is used for particular purposes) and as axes for visualizations (filling in this outline with percentages of a whole, for example)."" },      { ""S"" : ""This project is an interesting application of scrollytelling, and I think it works here since the background graphic stays consistent while scrolling progresses the user through different instances of that same base visual, instead of repeating that visual with text inbetween or showing those states as small multiples."" },      { ""S"" : ""Using the map as a background for visualization somewhat forces the author here into using a lot of tree maps or tree map-like charts, which I do NOT particularly care for. I think for me the lack of a shared axis makes it quite hard to compare across categories and these charts are only really useful when they're labeled - they're just a step above pie charts in this respect."" },      { ""S"" : ""There's also some wonkiness with which state of the of background graphic shows up and when that state changes. At times is doesn't seem totally synced up with the explanatory text in the front of the screen. The map also renders frustratingly off-center for me, with extra white spae at the top of the screen with the tip of Texas cut off."" }    ]  }}","Here's How America Uses Its Land"
"interactive viz","10/21/2018, 12:00:00 AM","{  ""link"" : { ""S"" : ""https://www.bloomberg.com/graphics/2018-women-candidates/"" },  ""pubDate"" : { ""S"" : ""Mon May 07 2018"" },  ""publication"" : { ""S"" : ""Bloomberg"" },  ""tags"" : { ""SS"" : [      ""mapping"",      ""politics"",      ""scrollytelling"",      ""small multiples"",      ""visualization""    ]  },  ""thoughts"" : { ""L"" : [      { ""S"" : ""I chose this project as a scrollytelling comparison with the Land Use Bloomberg project, but it's also a great example of how multiple visualizations provide comprehensive support to a well written story."" },      { ""S"" : ""There is a great visual connection between the text and the graphic, as the yellow highlighting in the text matches the yellow highlighting in the graphic. This scrollytelling also walks us through a much more linear narrative than the Land Use example. As possible seats won by women are whittled down, we see the graphic update accordingly. In the Land Use example there wasn't as much of a linear progression in how the graphic changed through each state, as the color and visualization method jumped around a bit more."" },      { ""S"" : ""I particularly enjoy the visual showing how the percentage of candidates who are women has shifted between 2000-2016 averages and 2018 levels. Plotting each point and showing the magnitude and direction of that movement visually is a really effective way to get a lot of information all at once without sacrificing aesthetics."" },      { ""S"" : ""Small multiples is used effectively here to see how the map has changed through recent years. However, I'd be interested to see how scrollytelling could be implemented here to make this point a little clearer - this visualization and story follows the same tenants that made scrollytelling so effective in the last vis on this page. I also think flipping the chronological order of these maps and showing the most recent map first is more confusing than it is intuitive."" }    ]  }}","Record Numbers of Women Running for Office May Not Mean Big Gains in Congress"
"interactive viz","11/1/2018, 7:37:30 PM","{  ""author"" : { ""SS"" : [      ""DENISE LU"",      ""K.K. REBECCA LAI"",      ""LISA LERER"",      ""TROY GRIGGS""    ]  },  ""link"" : { ""S"" : ""https://www.nytimes.com/interactive/2018/10/31/us/politics/midterm-election-candidates-diversity.html"" },  ""picture"" : { ""S"" : ""https://raw.githubusercontent.com/ryanabest/data-structures/master/week5/examples/FacesOfChange.png"" },  ""pubDate"" : { ""S"" : ""Wed Oct 31 2018"" },  ""publication"" : { ""S"" : ""New York Times"" },  ""social"" : { ""S"" : ""https://twitter.com/nytgraphics/status/1057667207809978368"" },  ""tags"" : { ""SS"" : [      ""election2018"",      ""politics"",      ""scrollytelling""    ]  },  ""thoughts"" : { ""L"" : [      { ""S"" : ""The use of candidates' faces as individual data points that stack up as parts of a whole is a really inventive and effective method for this piece. This mechanism allows the differences (or similarities) between skin tones, genders, and styles to become visually apparent as we compare subsets of the candidate pool - showing exactly the mechanisms this piece hopes to portray. Additionally, as groups become smaller in number, the faces of candidates in these groups become bigger and clearer, allowing us to physically see who it is that is challenging the status quo and representing the fight for inclusiveness in politics."" },      { ""S"" : ""The animation really helps us get a sense of scale as the statistics and groups we look at change."" },      { ""S"" : ""The authors transition well between animated scrollytelling and narrative using a consistent visual language, using the same face cutouts to introduce individual candidates in detail and populate an effective 2x2 matrix of candidate breakdown by party and white men / others."" },      { ""S"" : ""It doesn't seem like different faces occupy different areas when used as parts of a whole in data visualizations, staying true to having equal data represent equal space on the page and avoiding any potential misrepresentation of data."" },      { ""S"" : ""The biggest change I would suggest in this piece is starting out with every candidate's face on the page at once, then narrowing down to specific candidates/groups instead of starting more granular (with 28 more detailed faces on the screen, then zooming out). This change would really allow me to get a better sense of scale from the get-go - these candidates are among the most diverse set to run in elections, but what proportion of them represent a minority or under-represented group? This change would allow the piece to start off with insight, with the first visual being data-driven as opposed to only orienting me to the project style. This approach may lose the personal touch of seeing detailed faces at the beginning, but it would be a change I'd like to explore."" }    ]  }}","The Faces of Change in the Midterm Elections"
"interactive viz","11/1/2018, 7:50:51 PM","{  ""author"" : { ""S"" : ""Matt Daniels"" },  ""documentation"" : { ""S"" : ""https://blog.mapbox.com/3d-mapping-global-population-density-how-i-built-it-141785c91107"" },  ""link"" : { ""S"" : ""https://pudding.cool/2018/10/city_3d/"" },  ""picture"" : { ""S"" : ""https://pudding.cool/2018/10/city_3d/assets/social/social_facebook.png"" },  ""publication"" : { ""S"" : ""The Pudding"" },  ""social"" : { ""S"" : ""https://twitter.com/puddingviz/status/1055505311585497090"" },  ""tags"" : { ""SS"" : [      ""3D"",      ""MapBox"",      ""exploratory"",      ""guided narrative"",      ""interactive"",      ""mapping""    ]  },  ""thoughts"" : { ""L"" : [      { ""S"" : ""Beautiful use of MapBox and 3D visualization shows the physical density of the human population around the world, creating new city-scapes that represent the world's biggest urban areas."" },      { ""S"" : ""I am impressed with the technical execution of this piece, which brings together such a massive amount of data into a seamless expreience - the load times could be better, but I'm impressed with how good they are."" },      { ""S"" : ""This project excels at providing both a guided narrative and an exploratory tool, which is quite rarely executed so well as it is here."" }    ]  }}","Human Terrain"
"interactive viz","11/29/2018, 7:00:00 PM","{  ""author"" : { ""S"" : ""Russell Goldenberg"" },  ""link"" : { ""S"" : ""https://pudding.cool/2018/04/birthday-paradox/"" },  ""picture"" : { ""S"" : ""https://pudding.cool/2018/04/birthday-paradox/assets/img/birthday-intro.png"" },  ""publication"" : { ""S"" : ""The Pudding"" },  ""social"" : { ""S"" : ""https://twitter.com/puddingviz/status/983329526779392001"" },  ""tags"" : { ""SS"" : [      ""animation"",      ""anthropomorphism"",      ""community"",      ""crowd source"",      ""experiment"",      ""mathematics""    ]  },  ""thoughts"" : { ""L"" : [      { ""S"" : ""This wonderful interactive experiment explains the mathematical concepts behind the statistical 'birthday paradox' with delightful animations. It also incorporates the interactions of past users to play out the concepts it explains in real time, which helps makes the piece feel really personal and engaging."" },      { ""S"" : ""I love pretty much everything the Pudding produces, and this is one of the first pieces that got me excited about the site"" }    ]  }}","The Birthday Paradox"
"interactive viz","11/29/2018, 7:30:00 PM","{  ""author"" : { ""SS"" : [      ""Chris Davenport"",      ""John Muyskens"",      ""Monica Ulmanu"",      ""Youjin Shin""    ]  },  ""link"" : { ""S"" : ""wapo.st/busy-sky"" },  ""publication"" : { ""S"" : ""The Washington Post"" },  ""social"" : { ""S"" : ""https://twitter.com/JohnMuyskens/status/1072873947622973440"" },  ""thoughts"" : { ""L"" : [      { ""S"" : ""This project maps how commercial rocket launches cause airlines to divert their paths, which causes delays in air traffic and increases fuel consumption, in a really compelling 3-D animation of individual flights around a specific SpaceX launch off the coast of Florida. The panning zoom in and out of the globe on scroll and animated flight paths / rocket launch paths is super successful in both telling this specific story and thoroughly impressing me from both a technology and design standpoint."" }    ]  }}","Gridlock in the Sky"
"interactive viz","11/29/2018, 8:00:00 PM","{  ""author"" : { ""S"" : ""K.K. Rebecca Lai"" },  ""link"" : { ""S"" : ""https://www.nytimes.com/interactive/2018/01/21/world/year-in-weather.html#nyc"" },  ""picture"" : { ""S"" : ""https://raw.githubusercontent.com/ryanabest/data-structures/master/week5/examples/year-in-weather.png"" },  ""publication"" : { ""S"" : ""New York Times"" },  ""tags"" : { ""SS"" : [      ""classic"",      ""dense"",      ""weather""    ]  },  ""thoughts"" : { ""L"" : [      { ""S"" : ""This reworking of the classic NYT graphic is still one of the more data dense visualizations I've ever seen, containing record high/low temps, normal high/low temps, actual high/low temps, and monthly precipitation all in one graphic. The subtle animations go a long way as well – the moving globe and object permanance of the visualization make for a really nice interative experience."" }    ]  }}","How Much Warmer Was Your City in 2017?"
"interactive viz","11/3/2018, 5:28:29 PM","{  ""author"" : { ""SS"" : [      ""Allison McCartney"",      ""Brittany Harris"",      ""Dean Halford"",      ""Julian Burgess"",      ""Mira Rojanasakul""    ]  },  ""link"" : { ""S"" : ""https://www.bloomberg.com/graphics/2018-midterm-election-results/"" },  ""picture"" : { ""S"" : ""https://raw.githubusercontent.com/ryanabest/data-structures/master/week5/examples/Bloomberg%20Midterm%20Cartogram.png"" },  ""publication"" : { ""S"" : ""Bloomberg"" },  ""social"" : { ""S"" : ""https://twitter.com/BBGVisualData/status/1058385290073493505"" },  ""tags"" : { ""SS"" : [      ""cartogram"",      ""election2018"",      ""mapping"",      ""politics""    ]  },  ""thoughts"" : { ""L"" : [      { ""S"" : ""The cartogram view in this project does a great job of giving equal weight to each specific race, visually emphasizing each seat and not geography, while still maintaining general geographic relationships so I understand what I'm looking at - it successfully still LOOKS like a map but doesn't overemphasize physcial space like a typical map does."" },      { ""S"" : ""It does a great job of laying out each race but doesn't succeed as much in visually distinguishing the 'races to watch' in the cartogram as much as I'd hoped - I'd explore changing the color of the district to the likelihood of the winning party instead of incumbent party or an option to change the opacity of a district based on the competitiveness of the race there (with more competitive races being more opaque, thereby being visually distinguished a bit more)."" },      { ""S"" : ""I really enjoy how hovering over a state in the House cartogram breaks up the area into each district, labled with the district number. I also think this hover-over tooltip is well designed for the limited information it portrays - but % chance of winning for each candidate might be helpful and wouldn't clutter the design."" },      { ""S"" : ""The cartogram design is wonderful and portrays the national election landscape in a clear way, but I think there could be improvements to how much information is communicated in this visual, specifically in the color/opacity choices of each district."" }    ]  }}","Election 2018: The Races to Watch and How to Follow Them"
"interactive viz","12/1/2018, 4:00:00 PM","{  ""author"" : { ""S"" : ""Charlie Smart"" },  ""link"" : { ""S"" : ""https://pudding.cool/2018/01/chyrons/"" },  ""picture"" : { ""S"" : ""https://github.com/ryanabest/data-structures/blob/master/week5/examples/PuddingNews.png?raw=true"" },  ""publication"" : { ""S"" : ""The Pudding"" },  ""tags"" : { ""SS"" : [      ""explorative"",      ""narrative"",      ""news"",      ""politics"",      ""scrollytelling""    ]  },  ""thoughts"" : { ""L"" : [      { ""S"" : ""This piece does a great job of combining narrative data viz storytelling with opportunities for exploration. It's not easy to combine explorative and narrative in one piece, but this piece takes advantage of effective scrollytelling to show examples of how a user might explore each viz. I also particularly like the triangle scatterplot – it does a great job at visually demonstrating the relative tendencies of each news outlet."" }    ]  }}","The Differences in How CNN, MSNBC, & Fox Cover the News"
"interactive viz","12/1/2018, 4:30:00 PM","{  ""author"" : { ""S"" : ""Chris Forsberg"" },  ""link"" : { ""S"" : ""http://www.espn.com/espn/feature/story/_/id/24504654/kyrie-irving-art-sick-handles-nba"" },  ""picture"" : { ""S"" : ""http://a.espncdn.com/prod/styles/pagetype/otl/20181009_kyrieHandles/images/kyrie_desktop.gif"" },  ""publication"" : { ""S"" : ""ESPN"" },  ""tags"" : { ""SS"" : [      ""animation"",      ""basketball"",      ""sports""    ]  },  ""thoughts"" : { ""L"" : [      { ""S"" : ""I love the animations in this piece, showing abstractions of Kyrie Irving's exciting ball-handling skills. The piece effectively combines data visualization, animations, and in-game videos to paint a full picture of Irving's unique talent. However, I do think the interactive portion of the visualizations would work better as static - either through animation or a small multiples approach."" }    ]  }}","Inside Kyrie Irving's Bag of Tricks"
"interactive viz","12/1/2018, 5:00:00 PM","{  ""author"" : { ""SS"" : [      ""Kevin Quealy"",      ""Mike Bostock"",      ""Shan Carter""    ]  },  ""link"" : { ""S"" : ""http://www.nytimes.com/newsgraphics/2013/11/30/football-conferences/index.html"" },  ""picture"" : { ""S"" : ""http://graphics8.nytimes.com/newsgraphics/2013/11/30/football-conferences/71f2918fd830772afcf6433ebc6744b4e38ef94e/preview.png"" },  ""publication"" : { ""S"" : ""New York Times"" },  ""tags"" : { ""SS"" : [      ""bostock"",      ""sports""    ]  },  ""thoughts"" : { ""L"" : [      { ""S"" : ""The visualization technique here of a moving timeline with schools switching conferences in purple arrows is simple but effective at giving the landscape of conference sizes and movement over time. I particularly enjoy the hover and search bar to highlight a team and the narrative call-outs explaining interesting movements. The in-line bar chart demonstrating the decline in unaffiliated schools in the project intro is also a wonderfully subtle data viz nugget."" }    ]  }}","Tracing the History of N.C.A.A. Conferences"
"portfolio","10/21/2018, 12:00:00 AM","{  ""author"" : { ""S"" : ""Nadieh Bremer"" },  ""awards"" : { ""S"" : ""Information is Beautiful Awards 2017 - Best Individual"" },  ""example_project_link"" : { ""SS"" : [      ""http://www.datasketch.es/may/"",      ""https://www.visualcinnamon.com/portfolio/figures-in-the-stars""    ]  },  ""link"" : { ""S"" : ""https://www.visualcinnamon.com/portfolio/"" },  ""picture"" : { ""S"" : ""https://github.com/ryanabest/data-structures/blob/master/week5/examples/VisualCinnamon.png?raw=true"" },  ""tags"" : { ""SS"" : [      ""documentation"",      ""portfolio"",      ""process"",      ""visualization""    ]  },  ""thoughts"" : { ""L"" : [      { ""S"" : ""Nadieh Bremer has such an impressive portfolio of projects - she's got a wonderful eye for visual design and takes such expansive data sets and crafts really effective, beautiful visualizations from them."" },      { ""S"" : ""Her portfolio quite effectively showcases the visuals of her projects, focusing primarily on images of her output, while providing well crafted project intros, with a one paragraph project description and the overview of project specs / tools / data."" },      { ""S"" : ""She provides a great peek into her inspiration, thought process, and goals for each piece, giving high level context behind the big decisions she made."" },      { ""S"" : ""Also hidden in these project pages are links to more detailed blogs, posted on www.datasketch.es (a collaboration between her and software engineer & data visualizer Shirley Wu), which give exhaustive overviews on her entire process from inspiration through design sketches and coding."" },      { ""S"" : ""I think breaking these two pieces apart is really smart - it allows her to shine a light on the beautiful visual output of her work without bogging this page down with lengthy text without completely losing that useful detail."" }    ]  }}","Visual Cinnamon - Nadieh Bremer"
"portfolio","11/23/2018, 5:30:00 PM","{  ""author"" : { ""S"" : ""Adam Pearce"" },  ""link"" : { ""S"" : ""https://roadtolarissa.com/"" },  ""social"" : { ""S"" : ""https://twitter.com/adamrpearce"" },  ""thoughts"" : { ""L"" : [      { ""S"" : ""Adam Pearce is beyond impressive and has created some of my favorite projects from the Times recently, especially his piece on <a href='https://www.nytimes.com/interactive/2018/05/09/nyregion/subway-crisis-mta-decisions-signals-rules.html'>New York's subway crisis</a> and <a href='https://www.nytimes.com/interactive/2017/08/24/us/hurricane-harvey-texas.html'>hurricane trackers</a>. His portfolio is set up in a really unorthodox way, with project previews set on a continual spiral that we can stop and control by scrolling. While his page may not follow typical information design standards, it really showcases his creative approach to data storytelling."" }    ]  }}","roadtolarissa"
"portfolio","11/23/2018, 6:00:00 PM","{  ""link"" : { ""S"" : ""https://bost.ocks.org/mike/"" },  ""social"" : { ""S"" : ""https://twitter.com/mbostock"" },  ""thoughts"" : { ""L"" : [      { ""S"" : ""I feel pretty much forever indebted to Mike Bostock, the creator of d3. Some of his earlier work with the Times shows how well he understands how to design and build compelling data stories on the web, while his more recent work on tools like d3 and Observable has pushed the whole data viz field forward by leaps and bounds."" }    ]  }}","Mike Bostock"
